ligand_name,year,drugbank,chembl,indication,smiles,2d_image,pdb_link
Talquetamab,2023,DB16678,CHEMBL4594503,Relapsed/Refractory MM,not found,,
Teclistamab,2022,DB16655,CHEMBL4594505,MM,not found,,
Thalidomide,1998,DB01041,CHEMBL468,MM,O=C1CCC(N2C(=O)c3ccccc3C2=O)C(=O)N1,,
Blinatumomab,2014,DB09052,CHEMBL1742992,Precursor B-Lymphoblastic Lymphoma/Leukaemia Refractory; Relapsed B cell precursor ALL,not found,,
Inotuzumab Ozogamicin,2017,DB05889,CHEMBL2108611,Refractory B-cell precursor ALL; Relapsed B cell precursor ALL,not found,,
Nelarabine,2005,DB01280,CHEMBL1201112,Lymphoblastic lymphoma (Precursor T-lymphoblastic lymphoma/leukemia) refractory; Refractory ALL,COc1nc(N)nc2c1ncn2[C@@H]1O[C@H](CO)[C@@H](O)[C@@H]1O,,
Obecabtagene Autoleucel,2024,DB17362,CHEMBL5095440,Relapsed or refractory B-cell precursor ALL,not found,,
Tisagenlecleucel,2017,DB13881,CHEMBL3301574,Refractory B-cell precursor ALL; Second or later relapsed B-cell precursor ALL,not found,,
Azacitidine,2004,DB00928,CHEMBL1489,Acute Myeloid Leukemia (AML),Nc1ncn([C@@H]2O[C@H](CO)[C@@H](O)[C@H]2O)c(=O)n1,,
Cytarabine,1969,DB00987,CHEMBL803,Acute Myeloid Leukemia (AML),Nc1ccn([C@@H]2O[C@H](CO)[C@@H](O)[C@@H]2O)c(=O)n1,,
Daunorubicin,1979,DB00694,CHEMBL178,Acute Myeloid Leukemia (AML),COc1cccc2c1C(=O)c1c(O)c3c(c(O)c1C2=O)C[C@@](O)(C(C)=O)C[C@@H]3O[C@H]1C[C@H](N)[C@H](O)[C@H](C)O1,,
"Daunorubicin, Cytarabine Liposome",2017,DB00694,—,Acute Myeloid Leukemia (AML),not found,,
Gemtuzumab Ozogamicin,2000,DB00056,CHEMBL1201506,Acute Myeloid Leukemia (AML),not found,,
Glasdegib,2018,DB11978,CHEMBL2043437,Acute Myeloid Leukemia (AML),CN1CC[C@@H](NC(=O)Nc2ccc(C#N)cc2)C[C@@H]1c1nc2ccccc2[nH]1,,
Idarubicin,1990,DB01177,CHEMBL1117,Acute Myeloid Leukemia (AML),CC(=O)[C@]1(O)Cc2c(O)c3c(c(O)c2[C@@H](O[C@H]2C[C@H](N)[C@H](O)[C@H](C)O2)C1)C(=O)c1ccccc1C3=O,,
Midostaurin,2017,DB06595,CHEMBL608533,Acute Myeloid Leukemia (AML),CO[C@@H]1[C@H](N(C)C(=O)c2ccccc2)C[C@H]2O[C@]1(C)n1c3ccccc3c3c4c(c5c6ccccc6n2c5c31)C(=O)NC4,,
Olutasidenib,2022,DB16267,CHEMBL4297610,Refractory Acute Myeloid Leukemia (AML),C[C@H](Nc1ccc(C#N)n(C)c1=O)c1cc2cc(Cl)ccc2[nH]c1=O,,
Quizartinib,2023,DB12874,CHEMBL576982,Newly Diagnosed Acute Myeloid Leukemia (AML),CC(C)(C)c1cc(NC(=O)Nc2ccc(-c3cn4c(n3)sc3cc(OCCN5CCOCC5)ccc34)cc2)no1,,
Alemtuzumab,2001,DB00087,CHEMBL1201587,B-Cell CLL; T-Cell Prolymphocytic Leukemia,not  found,,
Duvelisib,2018,DB11952,CHEMBL3039502,Relapsed/Refractory CLL; Follicular Lymphoma,C[C@H](Nc1ncnc2nc[nH]c12)c1cc2cccc(Cl)c2c(=O)n1-c1ccccc1,,
Fludarabine,1991,DB01073,CHEMBL1568,B-cell CLL/prolymphocytic leukemia; Refractory NHL,Nc1nc(F)nc2c1ncn2[C@@H]1O[C@H](CO)[C@@H](O)[C@@H]1O,,
Lisocabtagene Maraleucel,2021,DB16582,CHEMBL4297236,High-grade B-cell lymphoma; Refractory DLBCL; Relapsed/refractory CLL/SLL,not  found,,
Obinutuzumab,2013,DB08935,CHEMBL1743048,Refractory Follicular Lymphoma; Previously untreated CLL,not  found,,
Ofatumumab,2009,DB06650,CHEMBL1201836,CLL; Refractory/Progressive CLL,not  found,,
Futibatinib,2022,DB15149,CHEMBL3701238,"Locally Advanced Intrahepatic Cholangiocarcinoma, Metastatic Intrahepatic ; Unresectable Intrahepatic H7",C=CC(=O)N1CC[C@H](n2nc(C#Cc3cc(OC)cc(OC)c3)c3c(N)ncnc32)C1,,
Altretamine,1990,DB00488,CHEMBL1455,Ovarian Cancer (Stage III),CN(C)c1nc(N(C)C)nc(N(C)C)n1,,
Dactinomycin,1964,DB00970,CHEMBL1554,Ovarian Cancer,Cc1c2oc3c(C)ccc(C(=O)N[C@@H]4C(=O)N[C@H](C(C)C)C(=O)N5CCC[C@H]5C(=O)N(C)CC(=O)N(C)[C@@H](C(C)C)C(=O)O[C@@H]4C)c3nc-2c(C(=O)N[C@@H]2C(=O)N[C@H](C(C)C)C(=O)N3CCC[C@H]3C(=O)N(C)CC(=O)N(C)[C@@H](C(C)C)C(=O)O[C@@H]2C)c(N)c1=O,,
Doxorubicin (Liposome),1998,Not found in DrugBank,CHEMBL53463,Ovarian Cancer (liposomal formulation),COc1cccc2c1C(=O)c1c(O)c3c(c(O)c1C2=O)C[C@@](O)(C(=O)CO)C[C@@H]3O[C@H]1C[C@H](N)[C@H](O)[C@H](C)O1,,
Irinotecan (Liposome),1996,DB00762,CHEMBL481,Ovarian Cancer (liposomal formulation),CCc1c2c(nc3ccc(OC(=O)N4CCC(N5CCCCC5)CC4)cc13)-c1cc3c(c(=O)n1C2)COC(=O)[C@]3(O)CC,,
Mirvetuximab Soravtansine,2022,DB12489,CHEMBL3545132," Ovarian Cancer, Platinum drug resistant Fallopian tube cancer",Not found,,
Rucaparib,2016,DB12332,CHEMBL1173055,Advanced Ovarian Cancer,CNCc1ccc(-c2[nH]c3cc(F)cc4c3c2CCNC4=O)cc1,,
Trabectedin,2015,DB05109,CHEMBL450449, Relapsed platinum-sensitive Ovarian cancer,COc1cc2c(cc1O)CCN[C@]21CS[C@@H]2c3c(OC(C)=O)c(C)c4c(c3[C@H](COC1=O)N1[C@@H]2[C@H]2c3c(cc(C)c(OC)c3O)C[C@@H]([C@@H]1O)N2C)OCO4,,
