ligand_name,year,drugbank,chembl,indication,smiles,2d_image,pdb_link
Aldesleukin,1992,DB00041,CHEMBL1201438,Metastatic Melanoma,not found,,
Binimetinib,2018,DB11967,CHEMBL3187723,Metastatic Melanoma; Unresectable Melanoma,Cn1cnc2c(F)c(Nc3ccc(Br)cc3F)c(C(=O)NOCCO)cc21,,
Carboplatin,1989,DB00958,CHEMBL1351,Advanced Melanoma,not found,,
Cisplatin,1978,DB00515,CHEMBL11359,Metastatic Melanoma,not found,,
Cobimetinib,2015,DB05239,CHEMBL2146883,Metastatic Melanoma; Unresectable Melanoma,O=C(c1ccc(F)c(F)c1Nc1ccc(I)cc1F)N1CC(O)([C@@H]2CCCCN2)C1,,
Dabrafenib,2013,DB08912,CHEMBL2028663,Metastatic Melanoma; Unresectable Melanoma,CC(C)(C)c1nc(-c2cccc(NS(=O)(=O)c3c(F)cccc3F)c2F)c(-c2ccnc(N)n2)s1,,
Dacarbazine,1975,DB00851,CHEMBL476,Metastatic Melanoma,CN(C)/N=N/c1[nH]cnc1C(N)=O,,
Encorafenib,2018,DB11718,CHEMBL3301612,Metastatic Melanoma; Unresectable Melanoma,COC(=O)N[C@@H](C)CNc1nccc(-c2cn(C(C)C)nc2-c2cc(Cl)cc(NS(C)(=O)=O)c2F)n1,,
Fotemustine,–,DB04106,CHEMBL549386,Metastatic Melanoma,CCOP(=O)(OCC)C(C)NC(=O)N(CCCl)N=O,,
Hydroxyurea,1967,DB01005,CHEMBL467,Melanomas,NC(=O)NO,,
Imatinib,2001,DB00619,CHEMBL941,Metastatic Melanoma,Cc1ccc(NC(=O)c2ccc(CN3CCN(C)CC3)cc2)cc1Nc1nccc(-c2cccnc2)n1,,
Interferon Alfa-2b,1986,DB00105,CHEMBL1201558,"Melanoma, Malignant",not found,,
Ipilimumab,2011,DB06186,CHEMBL1789844,Cutaneous Melanoma; Metastatic Melanoma; Unresectable Melanoma,not found,,
Lifileucel,2024,DB17107,CHEMBL4298200,Unresectable or Metastatic Melanoma,not found,,
Nab-Paclitaxel,2005,Not found,CHEMBL428647,Metastatic Melanoma,CC(=O)O[C@H]1C(=O)[C@@]2(C)[C@H]([C@H](OC(=O)c3ccccc3)[C@]3(O)C[C@H](OC(=O)[C@H](O)[C@@H](NC(=O)c4ccccc4)c4ccccc4)C(C)=C1C3(C)C)[C@]1(OC(C)=O)CO[C@@H]1C[C@@H]2O,,
Nivolumab,2015,DB09035,CHEMBL2108738,Melanomas; Metastatic Melanoma; Unresectable Melanoma,not found,,
Paclitaxel,1992,DB01229,CHEMBL428647,Metastatic Melanoma,CC(=O)O[C@H]1C(=O)[C@@]2(C)[C@H]([C@H](OC(=O)c3ccccc3)[C@]3(O)C[C@H](OC(=O)[C@H](O)[C@@H](NC(=O)c4ccccc4)c4ccccc4)C(C)=C1C3(C)C)[C@]1(OC(C)=O)CO[C@@H]1C[C@@H]2O,,
Peginterferon Alfa-2b,2001,DB00022,CHEMBL1201561,Melanomas,not found,,
Pembrolizumab,2014,DB09037,CHEMBL3137343,Metastatic Melanoma; Unresectable Melanoma,not found,,
Temozolomide,1999,DB00853,CHEMBL810,Advanced Melanoma,Cn1nnc2c(C(N)=O)ncn2c1=O,,
Trametinib,2013,DB08911,CHEMBL2103875,Metastatic Melanoma; Unresectable Melanoma,CC(=O)Nc1cccc(-n2c(=O)n(C3CC3)c(=O)c3c(Nc4ccc(I)cc4F)n(C)c(=O)c(C)c32)c1,,
Vemurafenib,2011,DB08881,CHEMBL1229517,Metastatic Melanoma; Unresectable Melanoma,CCCS(=O)(=O)Nc1ccc(F)c(C(=O)c2c[nH]c3ncc(-c4ccc(Cl)cc4)cc23)c1F,,
Vinblastine,1965,DB00570,CHEMBL159,Metastatic Melanoma,CC[C@]1(O)C[C@@H]2CN(CCc3c([nH]c4ccccc34)[C@@](C(=O)OC)(c3cc4c(cc3OC)N(C)[C@H]3[C@@](O)(C(=O)OC)[C@H](OC(C)=O)[C@]5(CC)C=CCN6CC[C@]43[C@@H]65)C2)C1,,
Vindesine,1979,DB00309,CHEMBL238071,"Melanoma, Malignant",CC[C@]1(O)C[C@@H]2CN(CCc3c([nH]c4ccccc34)[C@@](C(=O)OC)(c3cc4c(cc3OC)N(C)[C@H]3[C@@](O)(C(N)=O)[C@H](O)[C@]5(CC)C=CCN6CC[C@]43[C@@H]65)C2)C1,,
Relatlimab,2022,DB14851,CHEMBL3990044,Metastatic Melanoma; Unresectable Melanoma,not found,,
Bevacizumab,2004,DB00112,CHEMBL1201583,Cervical Cancer Metastatic; Persistent Cervical Cancer; Recurrent Cervical Cancer,not found,,
Bleomycin,1973,DB00290,CHEMBL403664,Cervical Cancers,Cc1c(N)nc([C@H](CC(N)=O)NC[C@H](N)C(N)=O)nc1C(=O)N[C@H](C(=O)N[C@H](C)[C@@H](O)[C@H](C)C(=O)N[C@H](C(=O)NCCc1nc(-c2nc(C(=O)NCCC[S+](C)C)cs2)cs1)[C@@H](C)O)[C@@H](O[C@@H]1O[C@@H](CO)[C@@H](O)[C@H](O)[C@@H]1O[C@H]1O[C@H](CO)[C@@H](O)[C@H](OC(N)=O)[C@@H]1O)c1c[nH]cn1,,
Gemcitabine,1996,DB00441,CHEMBL888, Cervical Cancers,Nc1ccn([C@@H]2O[C@H](CO)[C@@H](O)C2(F)F)c(=O)n1,,
Ifosfamide,1988,DB01181,CHEMBL1024, Cervical Cancers,O=P1(NCCCl)OCCCN1CCCl,,
Irinotecan,1996,DB00762,CHEMBL481," Recurrent, IV-B Cervical cance",CCc1c2c(nc3ccc(OC(=O)N4CCC(N5CCCCC5)CC4)cc13)-c1cc3c(c(=O)n1C2)COC(=O)[C@]3(O)CC,,
Irinotecan Liposome,1996,DB00762,CHEMBL481," Recurrent, IV-B Cervical cancer",CCc1c2c(nc3ccc(OC(=O)N4CCC(N5CCCCC5)CC4)cc13)-c1cc3c(c(=O)n1C2)COC(=O)[C@]3(O)CC,,
Mitomycin,1981,DB00305,CHEMBL105, Cervical Cancers,CO[C@@]12[C@H](COC(N)=O)C3=C(C(=O)C(C)=C(N)C3=O)N1C[C@@H]1N[C@@H]12,,
Pemetrexed,2004,DB00642,CHEMBL225072,"Recurrent, IV-B Cervical cancer",Nc1nc2[nH]cc(CCc3ccc(C(=O)N[C@@H](CCC(=O)O)C(=O)O)cc3)c2c(=O)[nH]1,,
Tisotumab Vedotin,2021,DB16732,CHEMBL4297841,Recurrent or metastatic cervical cancer,not found,,
Topotecan,1996,DB01030,CHEMBL84,"Recurrent, IV-B Cervical cancer",CC[C@@]1(O)C(=O)OCc2c1cc1n(c2=O)Cc2cc3c(CN(C)C)c(O)ccc3nc2-1,,
Vinorelbine,1994,DB00361,CHEMBL553025," Recurrent Cervical Cancer; Recurrent, IV-B Cervical cancer",CCC1=C[C@@H]2CN(C1)Cc1c([nH]c3ccccc13)[C@@](C(=O)OC)(c1cc3c(cc1OC)N(C)[C@H]1[C@@](O)(C(=O)OC)[C@H](OC(C)=O)[C@]4(CC)C=CCN5CC[C@]31[C@@H]54)C2,,
Belzutifan,2023,DB15463,CHEMBL4585668,Advanced Renal Cell Carcinoma,CS(=O)(=O)c1ccc(Oc2cc(F)cc(C#N)c2)c2c1[C@H](O)[C@H](F)[C@@H]2F,,
Cabozantinib,2012,DB08875,CHEMBL2105717,Advanced Renal Cell Carcinoma; Metastatic Clear Cell Renal Cell Carcinoma; ,COc1cc2nccc(Oc3ccc(NC(=O)C4(C(=O)Nc5ccc(F)cc5)CC4)cc3)c2cc1OC,,
Everolimus,2009,DB01590,CHEMBL1908360,Refractory Advanced Renal Cell Carcinoma; ,CO[C@H]1C[C@@H]2CC[C@@H](C)[C@@](O)(O2)C(=O)C(=O)N2CCCC[C@H]2C(=O)O[C@H]([C@H](C)C[C@@H]2CC[C@@H](OCCO)[C@H](OC)C2)CC(=O)[C@H](C)/C=C(\C)[C@@H](O)[C@@H](OC)C(=O)[C@H](C)C[C@H](C)/C=C/C=C/C=C/1C,,
Lenvatinib,2015,DB09078,CHEMBL1289601,Advanced Renal Cell Carcinoma; ,COc1cc2nccc(Oc3ccc(NC(=O)NC4CC4)c(Cl)c3)c2cc1C(N)=O,,
Medroxyprogesterone,1959,DB00603,CHEMBL717,Metastatic Renal Cell Carcinoma,CC(=O)O[C@]1(C(C)=O)CC[C@H]2[C@@H]3C[C@H](C)C4=CC(=O)CC[C@]4(C)[C@H]3CC[C@@]21C,,
Pazopanib,2009,DB06589,CHEMBL477772,Advanced Renal Cell Carcinoma;,Cc1ccc(Nc2nccc(N(C)c3ccc4c(C)n(C)nc4c3)n2)cc1S(N)(=O)=O,,
Sorafenib,2005,DB00398,CHEMBL1336,Advanced Renal Cell Carcinoma; ,CNC(=O)c1cc(Oc2ccc(NC(=O)Nc3ccc(Cl)c(C(F)(F)F)c3)cc2)ccn1,,
Sunitinib,2006,DB01268,CHEMBL535,Advanced Renal Cell Carcinoma; ,CCN(CC)CCNC(=O)c1c(C)[nH]c(/C=C2\C(=O)Nc3ccc(F)cc32)c1C,,
Temsirolimus,2007,DB06287,CHEMBL1201182,Advanced Renal Cell Carcinoma,CO[C@H]1C[C@@H]2CC[C@@H](C)[C@@](O)(O2)C(=O)C(=O)N2CCCC[C@H]2C(=O)O[C@H]([C@H](C)C[C@@H]2CC[C@@H](OC(=O)C(C)(CO)CO)[C@H](OC)C2)CC(=O)[C@H](C)/C=C(\C)[C@@H](O)[C@@H](OC)C(=O)[C@H](C)C[C@H](C)/C=C/C=C/C=C/1C,,
Tivozanib,2017,DB11800,CHEMBL1289494,Advanced Renal Cell Carcinoma; Renal Cell Adenocarcinoma,COc1cc2nccc(Oc3ccc(NC(=O)Nc4cc(C)on4)c(Cl)c3)c2cc1OC,,
Aflibercept,2011,DB08885,CHEMBL1742982,Metastatic Colorectal Cancer (MCRC),CC1=C(Br)SC2=C1C(C)=C(Br)S2,,
Cetuximab,2004,DB00002,CHEMBL1201577,Metastatic Colorectal Cancer (MCRC),N/A (monoclonal antibody),,
Epirubicin,1999,DB00445,CHEMBL417,Colorectal Cancers,COc1cccc2c1C(=O)c1c(O)c3c(c(O)c1C2=O)C[C@@](O)(C(=O)CO)C[C@@H]3O[C@H]1C[C@H](N)[C@@H](O)[C@H](C)O1,,
Fruquintinib,2023,DB11679,CHEMBL4303214,Metastatic Colorectal Cancer,CNC(=O)c1c(C)oc2cc(Oc3ncnc4cc(OC)c(OC)cc34)ccc12,,
Oxaliplatin,2002,DB00526,CHEMBL414804,Advanced Colorectal Cancer,not found,,
Panitumumab,2006,DB01269,CHEMBL1201827,Metastatic Colorectal Cancer (MCRC),N/A (monoclonal antibody),,
Raltitrexed,1996,DB00293,CHEMBL225071,Advanced Colorectal Cancer; Pleural Mesotheliomas,Cc1nc(=O)c2cc(CN(C)c3ccc(C(=O)N[C@@H](CCC(=O)O)C(=O)O)s3)ccc2[nH]1,,
Ramucirumab,2014,DB05578,CHEMBL1743062,Metastatic Colorectal Cancer,N/A (monoclonal antibody),,
Regorafenib,2012,DB08896,CHEMBL1946170,Metastatic Colorectal Cancer (MCRC),CNC(=O)c1cc(Oc2ccc(NC(=O)Nc3ccc(Cl)c(C(F)(F)F)c3)c(F)c2)ccn1,,
Trifluridine,1980,DB00432,CHEMBL1129,Metastatic Colorectal Cancer (MCRC),O=c1[nH]c(=O)n([C@H]2C[C@H](O)[C@@H](CO)O2)cc1C(F)(F)F,,
Doxorubicin,1974,DB00997,CHEMBL53463, Metastatic Breast Cancer+H4,COc1cccc2c1C(=O)c1c(O)c3c(c(O)c1C2=O)C[C@@](O)(C(=O)CO)C[C@@H]3O[C@H]1C[C@H](N)[C@H](O)[C@H](C)O1,,
Doxorubicin Liposome,1998,Not found in DrugBank,CHEMBL53463, Metastatic Breast Cancer,COc1cccc2c1C(=O)c1c(O)c3c(c(O)c1C2=O)C[C@@](O)(C(=O)CO)C[C@@H]3O[C@H]1C[C@H](N)[C@H](O)[C@H](C)O1,,
Cyclophosphamide,1959,DB00531,CHEMBL88, Breast Cancer,O=P1(N(CCCl)CCCl)NCCCO1,,
Mitoxantrone,1987,DB01204,CHEMBL58,Metastatic Breast Cancer,O=C1c2c(O)ccc(O)c2C(=O)c2c(NCCNCCO)ccc(NCCNCCO)c21,,
Methotrexate,1953,DB00563,CHEMBL34259, Breast Cancer,CN(Cc1cnc2nc(N)nc(N)c2n1)c1ccc(C(=O)N[C@@H](CCC(=O)O)C(=O)O)cc1,,
Thiotepa,1959,DB04572,CHEMBL671, Breast Adenocarcinoma; ,S=P(N1CC1)(N1CC1)N1CC1,,
Elacestrant,2023,DB06374,CHEMBL4297509,"Advanced Breast Cancer, Metastatic Breast Cancer",CCNCCc1ccc(CN(CC)c2cc(OC)ccc2[C@@H]2CCc3cc(O)ccc3C2)cc1,,
Megestrol Acetate,1971,DB00351,CHEMBL1201139,Advanced Breast Cancer,CC(=O)O[C@]1(C(C)=O)CC[C@H]2[C@@H]3C=C(C)C4=CC(=O)CC[C@]4(C)[C@H]3CC[C@@]21C,,
Goserelin,1989,DB00014,CHEMBL1201247,"Advanced Breast cancer ,Early Breast cancer",CC(C)C[C@H](NC(=O)[C@@H](COC(C)(C)C)NC(=O)[C@H](Cc1ccc(O)cc1)NC(=O)[C@H](CO)NC(=O)[C@H](Cc1c[nH]c2ccccc12)NC(=O)[C@H](Cc1cnc[nH]1)NC(=O)[C@@H]1CCC(=O)N1)C(=O)N[C@@H](CCCNC(=N)N)C(=O)N1CCC[C@H]1C(=O)NNC(N)=O,,
Anastrozole,1995,DB01217,CHEMBL1399,"Advanced Breast Cancer ,Early Breast Cancer ,       Locally Advanced Breast Cancer (LABC),               Metastatic Breast Cancer Invasive",CC(C)(C#N)c1cc(Cn2cncn2)cc(C(C)(C)C#N)c1,,
Letrozole,1997,DB01006,CHEMBL1444,Advanced Breast Cancer; Early Breast Cancer;     Metastatic HR + HER2 - breast cancer,N#Cc1ccc(C(c2ccc(C#N)cc2)n2cncn2)cc1,,
Abemaciclib,2017,DB12001,CHEMBL3301610,Advanced Breast Cancer; Metastatic Breast Cancer,CCN1CCN(Cc2ccc(Nc3ncc(F)c(-c4cc(F)c5nc(C)n(C(C)C)c5c4)n3)nc2)CC1,,
Ribociclib,2017,DB11730,CHEMBL3545110,Advanced Breast Cancer; Metastatic Breast Cancer,CN(C)C(=O)c1cc2cnc(Nc3ccc(N4CCNCC4)cn3)nc2n1C1CCCC1,,
Palbociclib,2015,DB09073,CHEMBL189963,Advanced Breast Cancer; Metastatic Breast Cancer; Refractory,CC(=O)c1c(C)c2cnc(Nc3ccc(N4CCNCC4)cn3)nc2n(C2CCCC2)c1=O,,
Alpelisib,2019,DB12015,CHEMBL2396661,Advanced Metastatic Breast Cancer,Cc1nc(NC(=O)N2CCC[C@H]2C(N)=O)sc1-c1ccnc(C(C)(C)C(F)(F)F)c1,,
Fulvestrant,2002,DB00947,CHEMBL1358,Advanced or Metastatic Breast Cancer;   Refractory,C[C@]12CC[C@@H]3c4ccc(O)cc4C[C@@H](CCCCCCCCC[S+]([O-])CCCC(F)(F)C(F)(F)F)[C@H]3[C@@H]1CC[C@@H]2O,,
Neratinib,2017,DB11828,CHEMBL180022,Breast Cancer,CCOc1cc2ncc(C#N)c(Nc3ccc(OCc4ccccn4)c(Cl)c3)c2cc1NC(=O)/C=C/CN(C)C,,
Tamoxifen,1977,DB00675,CHEMBL83,Breast Cancer; Invasive Breast Cancer; Invasive Breast Carcinoma; Metastatic Breast Cancer; ,CC/C(=C(\c1ccccc1)c1ccc(OCCN(C)C)cc1)c1ccccc1,,
Trastuzumab,1998,DB00072,CHEMBL1201585,Breast Cancer; Early Breast Cancer; Inflammatory Breast Cancer (IBC); Locally Advanced Breast Cancer (LABC);   Metastatic Breast Cancer;,not found,,
"Trastuzumab, Hyaluronidase",1998,DB00072,CHEMBL1201585,Breast Cancer; Early Breast Cancer; Inflammatory Breast Cancer (IBC); Locally Advanced Breast Cancer (LABC);   Metastatic Breast Cancer;,not found,,
Fluorouracil,1962,DB00544,CHEMBL185,Breast Cancer;,O=c1[nH]cc(F)c(=O)[nH]1,,
Tucatinib,2020,DB11652,CHEMBL3989868,Breast Cancer; Unresectable Breast Cancer,Cc1cc(Nc2ncnc3ccc(NC4=NC(C)(C)CO4)cc23)ccc1Oc1ccn2ncnc2c1,,
Toremifene,1997,DB00539,CHEMBL1655, Metastatic Breast Cancer,CN(C)CCOc1ccc(/C(=C(/CCCl)c2ccccc2)c2ccccc2)cc1,,
Capecitabine,1998,DB01101,CHEMBL1773, Metastatic Breast Cancer; ,CCCCCOC(=O)Nc1nc(=O)n([C@@H]2O[C@H](C)[C@@H](O)[C@H]2O)cc1F,,
Pertuzumab,2012,DB06366,CHEMBL2007641,Early Breast Cancer; Inflammatory Breast Cancer (IBC); Locally Advanced Breast Cancer (LABC); Metastatic Breast Cancer,not found,,
Exemestane,1999,DB00990,CHEMBL1200374,"Early Breast Cancer; Refractory, advanced Breast cancer",C=C1C[C@@H]2[C@H](CC[C@]3(C)C(=O)CC[C@@H]23)[C@@]2(C)C=CC(=O)C=C12,,
Docetaxel,1996,DB01248,CHEMBL92, Locally Advanced Breast Cancer (LABC)     Metastatic Breast Cancer; Node Positive Breast Cancer; ,CC(=O)O[C@@]12CO[C@@H]1C[C@H](O)[C@@]1(C)C(=O)[C@H](O)C3=C(C)[C@@H](OC(=O)[C@H](O)[C@@H](NC(=O)OC(C)(C)C)c4ccccc4)C[C@@](O)([C@@H](OC(=O)c4ccccc4)[C@H]21)C3(C)C,,
Olaparib,2014,DB09074,CHEMBL521686,Metastatic Breast Cancer; ,O=C(c1cc(Cc2n[nH]c(=O)c3ccccc23)ccc1F)N1CCN(C(=O)C2CC2)CC1,,
Trastuzumab Deruxtecan,2019,DB14962,CHEMBL4297844,HER2 Positive Breast Cancers,not found,,
Margetuximab,2020,DB14967,CHEMBL2364649,HER2-positive Metastatic Breast Cancer,not found,,
Capivasertib,2023,DB12218,CHEMBL2325741,"Hormone Receptor-positive, HER2-negative, Locally Advanced or Metastatic Breast Cancer",NC1(C(=O)N[C@@H](CCO)c2ccc(Cl)cc2)CCN(c2nc[nH]c3nccc2-3)CC1,,
Fluoxymesterone,1956,DB01185,CHEMBL1445,"Inoperable, metastatic Breast cancer",C[C@]1(O)CC[C@H]2[C@@H]3CCC4=CC(=O)CC[C@]4(C)[C@@]3(F)[C@@H](O)C[C@@]21C,,
Ixabepilone,2007,DB04845,CHEMBL1201752,Locally Advanced Breast Cancer (LABC); Metastatic Breast Cancer,C/C(=C\c1csc(C)n1)[C@@H]1C[C@@H]2O[C@]2(C)CCC[C@H](C)[C@H](O)[C@@H](C)C(=O)C(C)(C)[C@@H](O)CC(=O)N1,,
Talazoparib,2018,DB11760,CHEMBL3137320,Locally Advanced Breast Cancer (LABC); Metastatic Breast Cancer,Cn1ncnc1[C@H]1c2n[nH]c(=O)c3cc(F)cc(c23)N[C@@H]1c1ccc(F)cc1,,
Lapatinib,2007,DB01259,CHEMBL554,"Metastatic Breast Cancer; Refractory, advanced Breast cancer; Refractory, metastatic Breast cancer",CS(=O)(=O)CCNCc1ccc(-c2ccc3ncnc(Nc4ccc(OCc5cccc(F)c5)c(Cl)c4)c3c2)o1,,
Eribulin,2010,DB08871,CHEMBL1683590," Refractory, metastatic Breast cancer; ",C=C1C[C@@H]2CC[C@@]34C[C@H]5O[C@H]6[C@@H](O3)[C@H]3O[C@H](CC[C@@H]3O[C@H]6[C@H]5O4)CC(=O)C[C@@H]3[C@@H](OC)[C@@H](C[C@H](O)CN)O[C@H]3C[C@H]3O[C@@H](CC[C@@H]1O2)C[C@@H](C)C3=C,,
Atezolizumab,2016,DB11595,CHEMBL3707227, Triple Negative Breast Cancer (TNBC);,not found,,
Sacituzumab Govitecan,2020,DB12893,CHEMBL3545262,Metastatic Triple-negative Breast Cancer,not found,,
Adagrasib,2022,DB15568,CHEMBL4594350,"Locally Advanced Non-Small Cell Lung Cancer, Metastatic Non-Small Cell Lung Cancer",C=C(F)C(=O)N1CCN(c2nc(OC[C@@H]3CCCN3C)nc3c2CCN(c2cccc4cccc(Cl)c24)C3)C[C@@H]1CC#N,,
Afatinib,2013,DB08916,CHEMBL1173655,"Metastatic Non-Small Cell Lung Cancer; Refractory, metastatic squamous cell Non-small cell lung cancer",CN(C)C/C=C/C(=O)Nc1cc2c(Nc3ccc(F)c(Cl)c3)ncnc2cc1O[C@H]1CCOC1,,
Alectinib,2015,DB11363,CHEMBL1738797,"Refractory, metastatic Non small cell lung cancer",CCc1cc2c(cc1N1CCC(N3CCOCC3)CC1)C(C)(C)c1[nH]c3cc(C#N)ccc3c1C2=O,,
Amivantamab,2021,DB16695,CHEMBL4297774,"Locally Advanced Non-Small Cell Lung Cancer, Metastatic Non-Small Cell Lung Cancer",not found,,
Brigatinib,2017,DB12267,CHEMBL3545311,Metastatic Non-Small Cell Lung Cancer,COc1cc(N2CCC(N3CCN(C)CC3)CC2)ccc1Nc1ncc(Cl)c(Nc2ccccc2P(C)(C)=O)n1,,
Capmatinib,2020,DB11791,CHEMBL3188267,Metastatic Non-Small Cell Lung Cancer,CNC(=O)c1ccc(-c2cnc3ncc(Cc4ccc5ncccc5c4)n3n2)cc1F,,
Ceritinib,2014,DB09063,CHEMBL2403108,"Refractory, locally advanced Non-small cell lung cancer; Refractory, metastatic Non small cell lung cancer",Cc1cc(Nc2ncc(Cl)c(Nc3ccccc3S(=O)(=O)C(C)C)n2)c(OC(C)C)cc1C1CCNCC1,,
Crizotinib,2011,DB08865,CHEMBL601719,Metastatic Non-Small Cell Lung Cancer,C[C@@H](Oc1cc(-c2cnn(C3CCNCC3)c2)cnc1N)c1c(Cl)ccc(F)c1Cl,,
Dacomitinib,2018,DB11963,CHEMBL2110732,Metastatic Non-Small Cell Lung Cancer,COc1cc2ncnc(Nc3ccc(F)c(Cl)c3)c2cc1NC(=O)/C=C/CN1CCCCC1,,
Durvalumab,2017,DB11714,CHEMBL3301587,"Unresectable Stage III Non-small Cell Lung Cancer;  Unresectable, locally advanced PD-L1 positive Lung Cancer Non-Small Cell Cancer (NSCLC)",not found,,
Entrectinib,2019,DB11986,CHEMBL1983268,Non-Small Cell Lung Carcinoma (NSCLC); ,CN1CCN(c2ccc(C(=O)Nc3n[nH]c4ccc(Cc5cc(F)cc(F)c5)cc34)c(NC3CCOCC3)c2)CC1,,
Erlotinib,2004,DB00530,CHEMBL553,Locally Advanced Non-Small Cell Lung Cancer;                Metastatic Non-Small Cell Lung Cancer;                                 Non-Small Cell Lung Carcinoma (NSCLC); ,C#Cc1cccc(Nc2ncnc3cc(OCCOC)c(OCCOC)cc23)c1,,
Etoposide,1983,DB00773,CHEMBL44657, Non-Small Cell Lung Carcinoma (NSCLC); Small Cell Lung Cancer (SCLC);,COc1cc([C@@H]2c3cc4c(cc3[C@@H](O[C@@H]3O[C@@H]5CO[C@@H](C)O[C@H]5[C@H](O)[C@H]3O)[C@H]3COC(=O)[C@H]23)OCO4)cc(OC)c1O,,
Gefitinib,2003,DB00317,CHEMBL939,Metastatic Non-Small Cell Lung Cancer,COc1cc2ncnc(Nc3ccc(F)c(Cl)c3)c2cc1OCCCN1CCOCC1,,
Lorlatinib,2018,DB12130,CHEMBL3286830,"Progressive, metastatic Anaplastic lymphoma kinase-positive Metastatic Non-Small Cell Lung Cancer",C[C@H]1Oc2cc(cnc2N)-c2c(nn(C)c2C#N)CN(C)C(=O)c2ccc(F)cc21,,
Mobocertinib,2021,DB16390,CHEMBL4650319,"Locally Advanced Non-Small Cell Lung Cancer, Metastatic Non-Small Cell Lung Cancer",C=CC(=O)Nc1cc(Nc2ncc(C(=O)OC(C)C)c(-c3cn(C)c4ccccc34)n2)c(OC)cc1N(C)CCN(C)C,,
Necitumumab,2015,DB09559,CHEMBL1743047,Metastatic Non-Small Cell Lung Cancer,not found,,
Nintedanib,2014,DB09079,CHEMBL502835,Locally advanced Non-Small Cell Lung Cancer (NSCLC) caused by Adenocarcinoma; Locally recurrent Non-Small Cell Lung Cancer (NSCLC) caused by Adenocarcinoma; Metastatic Non-Small Cell Lung Cancer (NSCLC) caused by Adenocarcinoma,COC(=O)c1ccc2c(c1)NC(=O)/C2=C(\Nc1ccc(N(C)C(=O)CN2CCN(C)CC2)cc1)c1ccccc1,,
Osimertinib,2015,DB09330,CHEMBL3353410,Metastatic Non-Small Cell Lung Cancer,C=CC(=O)Nc1cc(Nc2nccc(-c3cn(C)c4ccccc34)n2)c(OC)cc1N(C)CCN(C)C,,
Pralsetinib,2020,DB15822,CHEMBL4297597,Metastatic RET-fusion Non Small Cell Lung Cancer,CO[C@@]1(CC[C@@H](CC1)C1=NC(NC2=NNC(C)=C2)=CC(C)=N1)C(=O)N[C@@H](C)C1=CC=C(N=C1)N1C=C(F)C=N1,,
Repotrectinib,2023,DB16826,CHEMBL4298138,locally active or metastatic non-small cell lung cancer,C[C@H]1CNC(=O)c2cnn3ccc(nc23)N[C@H](C)c2cc(F)ccc2O1,,
Selpercatinib,2020,DB15685,CHEMBL4559134, Metastatic RET-fusion Non Small Cell Lung Cancer; ,COc1ccc(CN2C3CC2CN(c2ccc(-c4cc(OCC(C)(C)O)cn5ncc(C#N)c45)cn2)C3)cn1,,
Sotorasib,2021,DB15569,CHEMBL4535757,"Locally Advanced Non-Small Cell Lung Cancer, Metastatic Non-Small Cell Lung Cancer",C=CC(=O)N1CCN(c2nc(=O)n(-c3c(C)ccnc3C(C)C)c3nc(-c4c(O)cccc4F)c(F)cc23)[C@@H](C)C1,,
Tepotinib,2021,DB15133,CHEMBL3402762,Metastatic Non-Small Cell Lung Cancer,CN1CCC(COc2cnc(-c3cccc(Cn4nc(-c5cccc(C#N)c5)ccc4=O)c3)nc2)CC1,,
Trastuzumab Emtansine,2013,DB05773,CHEMBL1743082,"Refractory, metastatic Non small cell lung cancer",not found,,
Tremelimumab,2022,DB11771,CHEMBL2108658,Metastatic Non-Small Cell Lung Cancer,not found,,
Vincristine,1965,DB00541,CHEMBL90555, Small Cell Lung Cancer (SCLC),CC[C@]1(O)C[C@H]2CN(CCc3c([nH]c4ccccc34)[C@@](C(=O)OC)(c3cc4c(cc3OC)N(C=O)[C@H]3[C@@](O)(C(=O)OC)[C@H](OC(C)=O)[C@]5(CC)C=CCN6CC[C@]43[C@@H]65)C2)C1,,
Vincristine Liposome,2012,DB00541,CHEMBL501867, Small Cell Lung Cancer (SCLC),CC[C@]1(O)C[C@H]2CN(CCc3c([nH]c4ccccc34)[C@@](C(=O)OC)(c3cc4c(cc3OC)N(C=O)[C@H]3[C@@](O)(C(=O)OC)[C@H](OC(C)=O)[C@]5(CC)C=CCN6CC[C@]43[C@@H]65)C2)C1.O=S(=O)(O)O,,
Bendamustine,2008,DB06769,CHEMBL487253,Refractory follicular NHL; Refractory mantle cell lymphoma; Indolent B-cell NHL,Cn1c(CCCC(=O)O)nc2cc(N(CCCl)CCCl)ccc21,,
Idelalisib,2014,DB09054,CHEMBL2216870,Relapsed follicular B-cell NHL; Relapsed small lymphocytic lymphoma (NHL subtype),CC[C@H](Nc1ncnc2[nH]cnc12)c1nc2cccc(F)c2c(=O)n1-c1ccccc1,,
Odronextamab,2024,DB16684,CHEMBL4298084,Relapsed/refractory B-cell non-Hodgkin lymphoma,not found,,
Decitabine,2006,DB01262,CHEMBL1201129,Myelodysplastic Syndromes ,Nc1ncn([C@H]2C[C@H](O)[C@@H](CO)O2)c(=O)n1,,
Ivosidenib,2018,DB14568,CHEMBL3989958,Myelodysplastic Syndromes ,N#Cc1ccnc(N2C(=O)CC[C@H]2C(=O)N(c2cncc(F)c2)[C@H](C(=O)NC2CC(F)(F)C2)c2ccccc2Cl)c1,,
BCG Vaccine,–,DB12768,CHEMBL2108905,Non-Invasive Bladder Urothelial Carcinoma; Recurrent Superficial Bladder Cancer; Urothelial Carcinoma Recurrent; Carcinoma in situ of urinary bladder,not found,,
Nadofaragene Firadenovec,2022,DB17381,CHEMBL3990041,High-risk BCG-unresponsive non-muscle invasive bladder cancer,not found,,
Lanreotide,2007,DB06791,CHEMBL1201185,"Unresectable, locally advanced enteropancreatic neuroendocrine tumors; Unresectable, locally advanced gastroenteropancreatic neuroendocrine tumors; Unresectable, metastatic enteropancreatic neuroendocrine tumors; Unresectable, metastatic gastroenteropancreatic neuroendocrine tumors",CC(C)[C@@H]1NC(=O)[C@H](CCCCN)NC(=O)[C@@H](Cc2c[nH]c3ccccc23)NC(=O)[C@H](Cc2ccc(O)cc2)NC(=O)[C@@H](NC(=O)[C@H](N)Cc2ccc3ccccc3c2)CSSC[C@@H](C(=O)N[C@H](C(N)=O)[C@@H](C)O)NC1=O,,
Lu 177-Dotatate,2018,DB13985,CHEMBL3989924,Gastroenteropancreatic Neuroendocrine Tumors,[177Lu+3].C[C@@H](O)[C@H](NC(=O)[C@@H]1CSSC[C@H](NC(=O)[C@@H](CC2=CC=CC=C2)NC(=O)CN2CCN(CC([O-])=O)CCN(CC([O-])=O)CCN(CC([O-])=O)CC2)C(=O)N[C@@H](CC2=CC=C(O)C=C2)C(=O)N[C@H](CC2=CNC3=C2C=CC=C3)C(=O)N[C@@H](CCCCN)C(=O)N[C@@H]([C@@H](C)O)C(=O)N1)C(O)=O,,
Porfimer,1995,DB00707,CHEMBL1201481,Esophageal Cancers,not found,,
Asciminib,2021,DB12597,CHEMBL4208229,Philadelphia chromosome-positive CML in chronic phase,O=C(Nc1ccc(OC(F)(F)Cl)cc1)c1cnc(N2CC[C@@H](O)C2)c(-c2cc[nH]n2)c1,,
Dasatinib,2006,DB01254,CHEMBL1421,ALL; CML,Cc1nc(Nc2ncc(C(=O)Nc3c(C)cccc3Cl)s2)cc(N2CCN(CCO)CC2)n1,,
Nilotinib,2007,DB04868,CHEMBL255863,Chronic Phase CML; Refractory GIST,Cc1cn(-c2cc(NC(=O)c3ccc(C)c(Nc4nccc(-c5cccnc5)n4)c3)cc(C(F)(F)F)c2)cn1,,
Omacetaxine Mepesuccinate,2009,DB04865,CHEMBL46286,Refractory accelerated & chronic phase CML,COC(=O)C[C@](O)(CCCC(C)(C)O)C(=O)O[C@@H]1C(OC)=C[C@]23CCCN2CCc2cc4c(cc2[C@H]13)OCO4,,
Abiraterone,2011,DB05812,CHEMBL254328,Metastatic castration-resistant prostate cancer,C[C@]12CC[C@H](O)CC1=CC[C@@H]1[C@@H]2CC[C@]2(C)C(c3cccnc3)=CC[C@@H]12,,
Apalutamide,2018,DB11901,CHEMBL3183409,Non-metastatic prostate cancer,CNC(=O)c1ccc(N2C(=S)N(c3cnc(C#N)c(C(F)(F)F)c3)C(=O)C23CCC3)cc1F,,
Cabazitaxel,2010,DB06772,CHEMBL1201748,Metastatic hormone-refractory prostate cancer,CO[C@H]1C(=O)[C@]2(C)[C@@H](OC)C[C@H]3OC[C@@]3(OC(C)=O)[C@H]2[C@H](OC(=O)c2ccccc2)[C@]2(O)C[C@H](OC(=O)[C@H](O)[C@@H](NC(=O)OC(C)(C)C)c3ccccc3)C(C)=C1C2(C)C,,
Darolutamide,2019,DB12941,CHEMBL4297185,Non-metastatic castration-resistant prostate cancer,CC(O)c1cc(C(=O)N[C@@H](C)Cn2ccc(-c3ccc(C#N)c(Cl)c3)n2)n[nH]1,,
Degarelix,2008,DB06699,CHEMBL415606,Advanced prostate cancer,CC(=O)N[C@H](Cc1ccc2ccccc2c1)C(=O)N[C@H](Cc1ccc(Cl)cc1)C(=O)N[C@H](Cc1cccnc1)C(=O)N[C@@H](CO)C(=O)N[C@@H](Cc1ccc(NC(=O)[C@@H]2CC(=O)NC(=O)N2)cc1)C(=O)N[C@H](Cc1ccc(NC(N)=O)cc1)C(=O)N[C@@H](CC(C)C)C(=O)N[C@@H](CCCCNC(C)C)C(=O)N1CCC[C@H]1C(=O)N[C@H](C)C(N)=O,,
Enzalutamide,2012,DB08899,CHEMBL1082407,Metastatic castration-resistant prostate cancer,CNC(=O)c1ccc(N2C(=S)N(c3ccc(C#N)c(C(F)(F)F)c3)C(=O)C2(C)C)cc1F,,
Estramustine,1981,DB01196,CHEMBL1575,Metastatic hormone-refractory prostate cancer,C[C@]12CC[C@@H]3c4ccc(OC(=O)N(CCCl)CCCl)cc4CC[C@H]3[C@@H]1CC[C@@H]2O,,
Histrelin,1991,DB06788,CHEMBL1201255,Advanced prostate cancer,CCNC(=O)[C@@H]1CCCN1C(=O)[C@H](CCCNC(=N)N)NC(=O)[C@H](CC(C)C)NC(=O)[C@@H](Cc1cn(Cc2ccccc2)cn1)NC(=O)[C@H](Cc1ccc(O)cc1)NC(=O)[C@H](CO)NC(=O)[C@H](Cc1c[nH]c2ccccc12)NC(=O)[C@H](Cc1cnc[nH]1)NC(=O)[C@@H]1CCC(=O)N1,,
Leuprolide,1985,DB00007,CHEMBL1201199,Advanced prostate cancer,CCNC(=O)[C@@H]1CCCN1C(=O)[C@H](CCCNC(=N)N)NC(=O)[C@H](CC(C)C)NC(=O)[C@@H](CC(C)C)NC(=O)[C@H](Cc1ccc(O)cc1)NC(=O)[C@H](CO)NC(=O)[C@H](Cc1c[nH]c2ccccc12)NC(=O)[C@H](Cc1c[nH]cn1)NC(=O)[C@@H]1CCC(=O)N1,,
Lutetium Lu 177 Vipivotide Tetraxetan,2022,DB16778,CHEMBL4594406,Metastatic castration-resistant prostate cancer (CRPC),Not found (radio-ligand),,
Nilutamide,1996,DB00665,CHEMBL1274,Metastatic hormone-refractory prostate cancer,CC1(C)NC(=O)N(c2ccc([N+](=O)[O-])c(C(F)(F)F)c2)C1=O,,
Padeliporfin,2017,DB15575,CHEMBL4298112,Low-risk prostate cancer (focal PDT),Not found,,
Prednisone,1955,DB00635,CHEMBL635,Used with abiraterone in CRPC regimens,C[C@]12C=CC(=O)C=C1CC[C@@H]1[C@@H]2C(=O)C[C@@]2(C)[C@H]1CC[C@]2(O)C(=O)CO,,
Radium-223 Dichloride,2013,DB08913,CHEMBL2107816,"Castration-resistant, metastatic prostate cancer",Cl[223Ra]Cl,,
Relugolix,2020,DB11853,CHEMBL1800159,Advanced prostate cancer,CONC(=O)Nc1ccc(-c2sc3c(c2CN(C)C)c(=O)n(-c2ccc(OC)nn2)c(=O)n3Cc2c(F)cccc2F)cc1,,
Sipuleucel-T,2010,DB06688,CHEMBL1237024,Metastatic hormone-refractory prostate cancer,Not found (cell-based therapy),,
Triptorelin,2000,DB06825,CHEMBL1201334,Advanced prostate cancer,CC(C)C[C@H](NC(=O)[C@@H](Cc1c[nH]c2ccccc12)NC(=O)[C@H](Cc1ccc(O)cc1)NC(=O)[C@H](CO)NC(=O)[C@H](Cc1c[nH]c2ccccc12)NC(=O)[C@H](Cc1c[nH]cn1)NC(=O)[C@@H]1CCC(=O)N1)C(=O)N[C@@H](CCCNC(=N)N)C(=O)N1CCC[C@H]1C(=O)NCC(N)=O,,
Tegafur,2011,DB09256,CHEMBL20883,Advanced Gastric Cancer,O=c1[nH]c(=O)n(C2CCCO2)cc1F,,
Gimeracil,1999,DB09257,CHEMBL1730601,Advanced Gastric Cancer,Oc1cc(O)c(Cl)cn1,,
Oteracil,1999,DB03209,CHEMBL181932,Advanced Gastric Cancer,O=C(O)c1nc(=O)[nH]c(=O)[nH]1,,
Uracil,1950,DB03419,CHEMBL566,Advanced Gastric Cancer,O=c1cc[nH]c(=O)[nH]1,,
Axitinib,2012,DB06626,CHEMBL1289926,Advanced Thyroid cancer,CNC(=O)c1ccccc1Sc1ccc2c(/C=C/c3ccccn3)n[nH]c2c1,,
Vandetanib,2011,DB05294,CHEMBL24828,Metastatic Medullary Thyroid Cancer; Locally advanced Medullary thyroid cancer,COc1cc2/c(=N/c3ccc(Br)cc3F)nc[nH]c2cc1OCC1CCN(C)CC1,,
Belantamab Mafodotin,2020,DB15719,CHEMBL4298209,Relapsed/Refractory MM,not found,,
Bortezomib,2003,DB00188,CHEMBL325041,MM,CCC1(c2ccc([N+](=O)[O-])cc2)CCC(=O)NC1=O,,
Ciltacabtagene Autoleucel,2022,DB16738,CHEMBL4802263,Relapsed/Refractory MM,not found,,
Daratumumab,2015,DB09331,CHEMBL1743007,MM; RRMM,not found,,
"Daratumumab, Hyaluronidase",2020,DB09331,CHEMBL1743007,MM; RRMM (SC formulation),not found,,
Dexamethasone,1958,DB01234,CHEMBL384467,MM (combo therapy),C[C@@H]1C[C@H]2[C@@H]3CCC4=CC(=O)C=C[C@]4(C)[C@@]3(F)[C@@H](O)C[C@]2(C)[C@@]1(O)C(=O)CO,,
Elotuzumab,2015,DB06317,CHEMBL1743010,RRMM,not found,,
Elranatamab,2023,DB15395,CHEMBL4297809,RRMM,not found,,
Idecabtagene Vicleucel,2021,DB16665,CHEMBL4298199,RRMM,not found,,
Isatuximab,2020,DB14811,CHEMBL3545131,MM,not found,,
Ixazomib,2015,DB09570,CHEMBL2141296,MM,CC(C)C[C@H](NC(=O)CNC(=O)c1cc(Cl)ccc1Cl)B(O)O,,
Lenalidomide,2005,DB00480,CHEMBL848,MM,Nc1cccc2c1CN(C1CCC(=O)NC1=O)C2=O,,
Melphalan,1964,DB01042,CHEMBL852,MM,N[C@@H](Cc1ccc(N(CCCl)CCCl)cc1)C(=O)O,,
Melphalan Flufenamide,2021,DB16627,CHEMBL4303060,RRMM,CCOC(=O)[C@H](Cc1ccc(F)cc1)NC(=O)[C@@H](N)Cc1ccc(N(CCCl)CCCl)cc1,,
Panobinostat,2015,DB06603,CHEMBL483254,RRMM,Cc1[nH]c2ccccc2c1CCNCc1ccc(/C=C/C(=O)NO)cc1,,
Pomalidomide,2013,DB08910,CHEMBL43452,RRMM,Nc1cccc2c1C(=O)N(C1CCC(=O)NC1=O)C2=O,,
Selinexor,2019,DB11942,CHEMBL3545185,RRMM,O=C(/C=C\n1cnc(-c2cc(C(F)(F)F)cc(C(F)(F)F)c2)n1)NNc1cnccn1,,
